{
  "$schema": "https://json-schema.org/draft/2020-12/schema",
  "title": "M15 O3 topology v2",
  "description": "Inventory comparison eligibility only; not physical attestation or negotiated PD/PPS equivalence.",
  "type": "object",
  "additionalProperties": false,
  "required": [
    "schema",
    "charger_inventory_sha256",
    "cable_inventory_sha256",
    "instrumentation_inventory_sha256",
    "power_source",
    "evidence_path",
    "observation_schema",
    "power_supply_contract"
  ],
  "properties": {
    "schema": {
      "const": "M15-topology-v2"
    },
    "charger_inventory_sha256": {
      "type": "string",
      "pattern": "^[0-9a-f]{64}$",
      "minLength": 64,
      "maxLength": 64
    },
    "cable_inventory_sha256": {
      "type": "string",
      "pattern": "^[0-9a-f]{64}$",
      "minLength": 64,
      "maxLength": 64
    },
    "instrumentation_inventory_sha256": {
      "type": "string",
      "pattern": "^[0-9a-f]{64}$",
      "minLength": 64,
      "maxLength": 64
    },
    "power_source": {
      "enum": [
        "pc-usb",
        "wall-charger",
        "pd-analyzer-source"
      ]
    },
    "evidence_path": {
      "enum": [
        "direct-usb",
        "ram-offline",
        "external-analyzer"
      ]
    },
    "observation_schema": {
      "const": "M15O3"
    },
    "power_supply_contract": {
      "const": "usb-or-usb-pd-v1"
    }
  }
}
